{
    "nodes": [
        [1, 1, 1],
        [2, -1, 1],
        [3, -1, -1],
        [4, -1, -1]
    ],
    "curves": [
        {"label": 1000,
        "degree": 1,
        "knotvector": [0, 0, 0.25, 0.5, 0.75, 1, 1],
        "ctrlpoints": [1, 2, 3, 4, 1]}
    ],
    "shapes": {
        "square": [1000]
    },
    "materials": {
        "steel": {
            "young_modulus": 210e+3,
            "poissons_ratio": 0.3
        }
    },
    "sections": {
        "square": {
            "shapes": ["square"],
            "materials": ["steel"]
        }
    }
}